Category,Message
0,dont thnk wrong calling us
0,sure night menu know noon menu
0,arr birthday today wish get oscar
0,say slowly god love amp need clean heart blood send ten special people amp u c miracle tomorrow pls pls
0,open rebtel firefox loads put plus sign user name place show two numbers lower number number pick number pin display okay
0,picking various points
1,married local women looking discreet action 5 real matches instantly phone text match 69969 msg cost 150p 2 stop txt stop bcmsfwc1n3xx
0,wow v v impressed funs shopping
0,way ur home
1,burger king wanna play footy top stadium get 2 burger king 1st sept go large super coca cola walk winner
0,problem talk later
0,ur sis
0,still customer place
1,come takes little time child afraid dark become teenager wants stay night
0,dude u knw also telugu thts gud k gud nyt
0,confirm eating esplanade
0,send id password
0,kind took garage centre part exhaust needs replacing part ordered n taking fixed tomo morning
1,ur chance win 250 cash every wk txt action 80608 c www movietrivia tv custcare 08712405022 1x150p wk
0,well might come
0,long quit get like 5 minutes day
0,likely called mittelschmertz google dont paracetamol dont worry go
0,well right gonna get check today steam sales pee text want come get
0,arrived see couple days lt 3
0,k wat tht incident
0,yeah get unlimited
0,cthen thk shd b enuff still got conclusion n contents pg n references b da contents pg n cover pg
0,forgot takes 3 years shower sorry phone dead yet
0,ü got wat buy tell us ü need come
0,big god bring success
1,u bin awarded 50 play 4 instant cash call 08715203028 claim every 9th player wins min 50 500 optout 08718727870
0,r stayin extra week back next wed rugby weekend hi c u soon
0,well still bit left guys want tonight
0,campus library
0,affidavit says lt gt e twiggs st division g courtroom lt gt lt time gt double check text tomorrow
0,creep _
0,tell friends plan valentines day lt url gt
0,get ten billion calls texts help god
0,purity friendship two smiling reading forwarded message smiling seeing name gud evng musthu
0,told returned order
0,house maid murderer coz man murdered lt gt th january public holiday govt instituitions closed including post office
0,depends u going lor
0,smile right go world wonder smiling think crazy keep away grins
1,freemsg fav xmas tones reply real
0,lil fever fine
0,think still car
0,
1,december mobile 11mths entitled update latest colour camera mobile free call mobile update co free 08002986906
0,yes princess want catch big strong hands
0,oh yeah forgot u take 2 shopping
0,mm asked call radio
0,thinkin someone good drugs
0,say slowly god love amp need clean heart blood send ten special people amp u c miracle tomorrow pls pls
0,enjoy showers possessiveness poured u ur loved ones bcoz world lies golden gift loved truly
0,alright sure let know leaving
0,lasting much 2 hours might get lucky
0,genius brother pls send number skype
1,gr8 poly tones 4 mobs direct 2u rply poly title 8007 eg poly breathe1 titles crazyin sleepingwith finest ymca getzed co uk pobox365o4w45wq 300p
0,thk em find wtc far weiyi goin e rest dunno yet r ur goin 4 dinner den might b able join
0,forget owns private property good boy always passionate kiss
1,interflora late order interflora flowers christmas call 0800 505060 place order midnight tomorrow
0,oh god taken teeth paining
1,romcapspam everyone around responding well presence since warm outgoing bringing real breath sunshine
0,u ask darren go n pick u lor oso sian tmr haf 2 meet lect
0,need buy lunch eat maggi mee
1,congratulations thanks good friend u 2 000 xmas prize 2 claim easy call 08712103738 10p per minute bt national rate
0,ok lor
0,oh right ok make sure loads work day got really nasty cough today dry n shot really help
0,wife knew time murder exactly
1,send logo 2 ur lover 2 names joined heart txt love name1 name2 mobno eg love adam eve 07123456789 87077 yahoo pobox36504w45wq txtno 4 ads 150p
0,howz persons story
0,thanx 4 sending home
0,normally hot mail com see
1,tkts euro2004 cup final 800 cash collect call 09058099801 b4190604 pobox 7876150ppm
0,u sick still go shopping
0,ya well fine bbd pooja full pimples even become quite black ur rite cold wearing sweatter
0,nice nice working
0,1 reach home call
0,trying find chinese food place around
0,easy mate guess quick drink bit ambitious
0,babe miiiiiiissssssssss need crave geeee sad without babe love
0,ok thanx
0,aathi dear
0,tunji queen wishing great day abiola
0,today iz yellow rose day u love frndship give 1 misscall amp send ur frndz amp see many miss calls u get u get 6missed u marry ur lover
0,class hours sorry
0,wat time u finish ur lect today
1,free message jamster get crazy frog sound poly text mad1 real text mad2 88888 6 crazy sounds 3 gbp week 16 c apply
0,sad story man last week b day wife nt wish parents forgot n kids went work even colleagues wish entered cabin pa said happy b day boss felt special askd 4 lunch lunch invited apartment went said u mind go bedroom minute ok sed sexy mood came 5 minuts latr wid cake n wife parents kidz friends n colleagues screaming surprise waiting sofa naked
1,chance reality fantasy show call 08707509020 20p per min ntt ltd po box 1327 croydon cr9 5wb 0870 national rate call
0,fine good hear dear happy new year oh
0,going wipro interview today
0,tall princess
0,doubt could handle 5 times per night case
0,haha hope ü hear receipt sound gd luck
0,gonna death gonna leave note says robs fault avenge
0,japanese proverb one u none u must indian version one let none leave finally kerala version one stop none make strike
0,today workin free oso gee thgt u workin ur fren shop
0,life face choices toss coin becoz settle question coin air u know heart hoping gudni8
0,know god created gap fingers one made comes amp fills gaps holding hand love
0,want kiss feel next
0,happy saying
1,adult 18 content video shortly
0,ok would b lovely u r sure think wot u want drinkin dancin eatin cinema u wot
0,saying explicitly told nora know someone probably gonna bother
0,says hi get ass back south tampa preferably kegger
0,smith waste da wanna gayle
0,mum sent many many messages since got want know actually getting enjoy rest day
0,aight tomorrow around lt gt
0,house maid murderer coz man murdered lt gt th january public holiday govt instituitions closed including post office understand
1,chance reality fantasy show call 08707509020 20p per min ntt ltd po box 1327 croydon cr9 5wb 0870 national rate call
0,actually first time went bed long spoke woke 7 night
0,see
0,dont understand message
0,crucify c told earlier
0,idk keep saying since moved keep butting heads freedom vs responsibility tired much shit deal barely keeping together gets added
0,fuck cedar key fuck come anyway tho
0,twenty past five said train durham already coz reserved seat
1,hey boys want hot xxx pics sent direct 2 ur phone txt porn 69855 24hrs free 50p per day stop text stopbcm sf wc1n3xx
0,u still painting ur wall
1,last chance claim ur 150 worth discount vouchers today text shop 85023 savamob offers mobile cs savamob pobox84 m263uz 3 00 sub 16
0,printer cool mean groovy wine groovying
0,hi harish rent transfred ur acnt
0,anything lor coming
0,cbe really good nowadays lot shop showrooms city shaping good
0,ü still attending da talks
0,probs hon u doinat mo
0,k take care
0,take phone callon friday assume year
0,battery low babe
0,shuhui bought ron present swatch watch
0,yeah quite bit left swing tomorrow get
0,babe said 2 hours almost 4 internet
0,k sure get noon see
0,k k yesterday cbe
0,went ganesh dress shop
1,pdate_now double mins 1000 txts orange tariffs latest motorola sonyericsson nokia bluetooth free call mobileupd8 08000839402 call2optout yhl
0,ü collecting ur laptop going configure da settings izzit
0,r home come within 5 min
0,aight 8 latest probably closer 7 jay tyler two trips
0,come aftr lt decimal gt cleaning house
1,ur cash balance currently 500 pounds maximize ur cash send cash 86688 150p msg cc 08718720201 po box 114 14 tcr w1
0,bill letters expecting one orange bill may still say orange
0,tell pa pain de
0,hi darlin hope nice night wish come cant wait see love fran ps want dirty anal sex want 10 man gang bang
0,ha know either clever simple thing pears day perfect christmas
0,helloooo wake sweet morning welcomes enjoy day full joy gud mrng
0,alrite
0,must sit around wait summer days celebrate magical sight worlds dressed white oooooh let snow
1,urgent mobile number awarded 2000 prize guaranteed call 09058094454 land line claim 3030 valid 12hrs
0,guys go see movies side
0,sorry meeting call later
0,tell thinking plus going stop runs
0,kindly send one flat lt decimal gt today
1,sorry u unsubscribe yet mob offer package min term 54 weeks pls resubmit request expiry reply themob help 4 info
0,nothing lor bit bored dun u go home early 2 sleep today
0,time tell friend around
0,yes fine love safe
0,thanks chikku gud nyt
0,xy ur car u picking
0,thanx 4 time spent 2geva bin mint ur baby want u xxxx
0,yo way could pick something tonight
0,sent send
0,fine simply sitting
0,thts god gift birds humans hav natural gift frm god
0,coming day class
0,im done studyn library
0,ok u enjoy ur shows
0,anything
0,wuld without baby thought alone mite break wanna go crazy everyboy needs lady xxxxxxxx
0,wat dear sleeping ah
0,hi test lt gt rd
0,2 students solved cat question xam 5 3 2 lt gt 9 2 4 lt gt 8 6 3 lt gt 7 2 5 tell answer u r brilliant 1thing got answr
0,yo know anyone lt gt otherwise able buy liquor guy flaked right get hold somebody 4 loko night
0,yup n fren lor meeting fren 730
0,yeah got one lined us
0,stop wondering wow ever going stop tm ing tm whenever want mine laughs
0,lol yep yesterday already got fireplace another icon sitting
0,hey booked pilates yoga lesson already haha
0,ok happen behave like
1,1 new message please call 08712400200
0,supervisor find 4 one lor thk students havent ask yet tell u aft ask
0,hello news job making wait fifth week yeah im woozles weasels exeter still home 3
0,message responce happend
1,currently message awaiting collection collect message call 08718723815
0,hey babe sorry get sooner gary come fix cause thinks knows go far ptbo says cost lt gt bucks know might cheaper find someone second hand machines right let know want babe
0,make 3 4 fucks sake x
0,leave u always ignorant
0,nope b going 2 sch fri quite early lor cos mys sis got paper da morn
0,bruce b downs amp fletcher
0,said would woke
0,hey free call
0,tell whos pls
1,urgent mobile awarded 1 500 bonus caller prize 27 6 03 final attempt 2 contact u call 08714714011
0,think might give miss teaching til twelve lecture two damn working thing
0,id check like 1 bowls worth left
0,yes many sweets
0,would still cozy exhausted last night nobody went school work everything closed
1,u secret admirer reveal thinks u r special call 09065174042 opt reply reveal stop 1 50 per msg recd cust care 07821230901
0,buzzzz grins buzz ass buzz chest buzz cock keep phone vibrator feel shake
0,sir send group mail check
0,da intro covers energy trends n pros n cons brief description nuclear fusion n oso brief history iter n jet got abt 7 n half pages
0,none nowhere ikno doesdiscount shitinnit
0,dont know jabo abi
1,ever notice driving anyone going slower idiot everyone driving faster maniac
0,yet ya sapna aunty manege day hogidhe chinnu full weak swalpa black agidhane
0,good baby
0,neft transaction reference number lt gt rs lt decimal gt credited beneficiary account lt gt lt time gt lt gt
0,mostly sports type lyk footbl crckt
0,head dey swell oh thanks making day
0,u make fb list
0,height confidence aeronautics professors wer calld amp wer askd 2 sit aeroplane aftr sat wer told dat plane ws made students dey hurried plane bt 1 didnt move said made students wont even start datz confidence
0,sary need tim bollox hurt lot tol
0,happy new year princess
0,text carlos let know hang
0,worry easy ingredients
0,love u 2 little pocy bell sorry love u
0,ok omw castor
0,yar lor keep raining non stop u wan 2 go elsewhere
1,xmas offer latest motorola sonyericsson nokia free bluetooth dvd double mins 1000 txt orange call mobileupd8 08000839402 call2optout 4qf2
0,u mean u almost done done wif sleeping tot u going take nap yup send liao picking ard 4 smth lor
0,7 wonders world 7th 6th ur style 5th ur smile 4th ur personality 3rd ur nature 2nd ur sms 1st ur lovely friendship good morning dear
0,tonight yeah
0,eat fo lunch senor
0,said right giggle saw u would possibly first person2die nvq think much could
0,break time one come n get stuff fr ü
1,reply win 100 weekly professional sport tiger woods play send stop 87239 end service
0,see see maybe reboot ym seen buzz
0,still grinder
1,1 polyphonic tone 4 ur mob every week txt pt2 87575 1st tone free get txtin tell ur friends 150p tone 16 reply hl 4info
0,love decision feeling could decide love life would much simpler less magical
1,hot live fantasies call 08707509020 20p per min ntt ltd po box 1327 croydon cr9 5wb 0870 national rate call
0,k see k
0,list buyers
0,idea guess work hour supposed leave since usual nobody interest figuring shit last second
0,mm entirely sure understood text hey ho weekend
0,released vday shirts u put makes bottom half naked instead white underwear
0,know watching film computer
0,b4 thursday
0,oh phone phoned disconnected
0,id onluy matters getting offcampus
1,message free welcome new improved sex dogging club unsubscribe service reply stop msgs 150p 18
0,excellent see riley plans
0,see half hour
1,tkts euro2004 cup final 800 cash collect call 09058099801 b4190604 pobox 7876150ppm
0,ew one
0,also hi wesley
0,ah see lingo let know wot earth finished making
1,loan purpose 500 75 000 homeowners tenants welcome previously refused still help call free 0800 1956669 text back help
1,update_now 12mths half price orange line rental 400mins call mobileupd8 08000839402 call2optout j5q
0,imagine life without see fast u searching worry l always disturb u goodnoon
0,hm good morning headache anyone
0,yeah probs last night obviously catching speak soon
1,free unlimited hardcore porn direct 2 mobile txt porn 69200 get free access 24 hrs chrgd 50p per day txt stop 2exit msg free
0,might go 2 sch yar e salon v boring
0,lt gt mins stop somewhere first
0,lt gt fast approaching wish u happy new year happy sankranti happy republic day happy valentines day happy shivratri happy ugadi happy fools day happy may day happy independence day happy friendship mother father teachers childrens day amp happy birthday 4 u happy ganesh festival happy dasara happy diwali happy christmas lt gt good mornings afternoons evenings nights rememberi first wishing u raj
0,one joys lifeis waking daywith thoughts somewheresomeone cares enough tosend warm morning greeting
0,get second half message
0,wat time u wan 2 meet later
0,thank much selflessness love plenty
0,film ill call later
0,dare change ring
0,bad girl lady
0,love ya try budget money better babe gary would freak knew
0,part initiate understand
0,finished lunch already u wake already
0,still game
0,got tallent wasting
0,record one night
0,also sir sent email log usc payment portal send another message explain things back home great weekend
0,gonna let know cos comes bak holiday day coming t4get2text number
0,jokin lar depends phone father get lor
0,aight lemme know
0,get ready lt gt inches pleasure
0,raji pls favour pls convey birthday wishes nimya pls today birthday
0,ok feel like john lennon
0,cos darren say ü considering mah ask ü
0,bothering trust answers pls
0,wishing family merry x mas happy new year advance
0,one day crab running sea shore waves came n cleared footprints crab crab asked frnd r u clearing beautiful footprints waves replied fox following ur footprints catch thats cleared frndsship never lets u dwn gud nyt
0,aight time want come
0,slaaaaave must summon time wish come anymore
0,bill 3 33 65 thats bad
0,let know changes next 6hrs even appendix age range however impossible chill let know 6hrs
0,hello yeah got bath need hair come done yeah
0,weather
0,ok much though h friday cant wait dunno wot hell im gonna another 3 weeks become slob oh wait already done
0,die e toot fringe
0,lol know awesome phone could click delete right want
0,ok
0,awesome question cute answer someone asked boy ur life smiled amp answered fine gudnite
0,please leave topic sorry telling
0,pls send correct name da
0,happened yo date
1,eastenders tv quiz flower dot compare violet e tulip f lily txt e f 84025 4 chance 2 win 100 cash wkent 150p16
0,webpage available
0,woke yeesh late fall asleep til lt gt
1,unsubscribed services get tons sexy babes hunks straight phone go http gotbabes co uk subscriptions
0,dear know lt gt th lt gt th birthday loving gopalettan planning give small gift day like participate welcome please contact admin team details
0,k k tomorrow onwards started ah
0,u talking bout early morning almost noon
0,fine remember
1,hi babe jordan r u im home abroad lonely text back u wanna chat xxsp visionsms com text stop stopcost 150p 08712400603
0,ok many buy
0,sounds good keep posted
1,get brand new mobile phone agent mob plus loads goodies info text mat 87021
0,ok april cant wait
0,boy best get yo ass quick
0,ay wana meet sat ü wkg sat
0,wait till 2 bus pick
0,apart one told yesterday
0,ok lor buy wat
0,somebody go andros steal ice
0,know msg recently
0,take us shopping mark distract isaiah
0,mum hope great day hoping text meets well full life great day abiola
0,sense foot penis
0,okay thought expert
0,deep sigh miss really surprised gone net cafe yet get miss
0,thinl role like sachin standing others hit
0,great trip india bring light everyone project everyone lucky see smile bye abiola
0,importantly discuss u
0,k k training process
0,ok lor ned 2 go toa payoh 4 2 return smth u wan 2 send wat
0,da car park
0,wish holding tightly making see important much mean much need life
0,asked anthony dad bf
0,wnevr wana fal luv vth books bed fals luv vth yen madodu nav pretsorginta nammanna pretsovru important alwa gud eveb
0,today sunday sunday holiday work
0,going take bath ill place key window
1,lord rings return king store reply lotr 2 june 4 chance 2 win lotr soundtrack cds stdtxtrate reply stop end txts
0,dear take care reaching home love u lot
0,staff science nus edu sg phyhcmk teaching pc1323
0,emigrated something ok maybe 5 30 bit hopeful
0,olol printed forum post guy exact prob fixed gpu replacement hopefully dont ignore
0,walked moms right stagwood pass right winterstone left victors hill address lt gt
0,yo jp hungry like mofo
0,creepy crazy
0,ok din get ur msg
0,tessy pls favor pls convey birthday wishes nimya pls dnt forget today birthday shijas
0,pathaya enketa maraikara pa
0,even friend priest call
0,u lousy run already come back half dead hee
0,said bad dat e gals know u wat u
0,remind hrs
0,hoping would send message rent due dont enough reserves completely gone loan need hoping could balance lt gt way could get till mid march hope pay back
0,hi happy new year dont mean intrude pls let know much tuition paid last semester much semester thanks
0,hello hun ru way im good 2 dates guy met walkabout far meet soon hows everyone else
0,lol gonna last month cashed left lt gt case collecting week cause announced blog
1,good luck draw takes place 28th feb 06 good luck removal send stop 87239 customer services 08708034412
0,short cute good person dont try prove gud mrng
0,decided yet eh
0,wat time liao still got
0,yes watching footie worried going blow phil neville
0,wait 4 ü inside da car park
0,uncle abbey happy new year abiola
0,free call pa
0,r u saying order slippers cos pay returning
0,stop knowing well
0,good evening roger
0,small problem auction punj asking tiwary
1,free entry 2 weekly comp chance win ipod txt pod 80182 get entry std txt rate c apply 08452810073 details 18
0,telling tell one treat hi hi hi
0,uncles atlanta wish guys great semester
1,1st wk free gr8 tones str8 2 u wk txt nokia 8007 classic nokia tones hit 8007 polys nokia 150p poly 200p 16
0,u coming 2 pick
0,thats cool liked photos sexy
0,would u fuckin believe didnt know thurs pre booked cancelled needs b sacked
0,haha better late ever way could swing
0,ok finish 6
1,lookatme thanks purchase video clip lookatme charged 35p think better send video mmsto 32323
0,barred b q stores life twat orange dungerees came asked wanted decking got first punch
0,messages food
0,ok going sleep hope meet
0,wat makes people dearer de happiness dat u feel u meet de pain u feel u miss dem
0,let know details fri u find cos tom fri mentionned chinese thanks
0,right think
0,wat r u
0,ur lecture
1,sexy sexy cum text im wet warm ready porn u fun msg free recd msgs 150p inc vat 2 cancel text stop
0,customer place call
0,planned yet going join company jan 5 know happen
0,boy love u grl hogolo boy gold chain kodstini grl agalla boy necklace madstini grl agalla boy hogli 1 mutai eerulli kodthini grl love u kano
0,haha heard text around
0,get tomorrow send
0,shit babe thasa bit messed yeh shudvetold u urgran know neway illspeak 2 u2moro wen im asleep
0,oh thats late well good night give u call tomorrow iam going go sleep night night
0,cheers u tex mecause u werebored yeah okden hunny r uin wk sat sound likeyour havin gr8fun j keep updat countinlots loveme xxxxx
0,sorry meeting call later
0,yo howz u girls never rang india l
0,yeah worse
1,hard live 121 chat 60p min choose girl connect live call 09094646899 cheap chat uk biggest live service vu bcm1896wc1n3xx
0,tagged friends seemed count friends
1,heard u4 call 4 rude chat private line 01223585334 cum wan 2c pics gettin shagged text pix 8552 2end send stop 8552 sam xxx
0,ok
0,long time remember today
0,havent shopping lor juz arrive
0,thank u better work cause feel used otherwise
0,challenge know
0,much ur hdd casing cost
0,mystery solved opened email sent another batch sweetie
0,describe lucky actually awake noon
1,2nd time tried contact u u 1450 prize claim call 09053750005 b4 310303 cs stop sms 08718725756 140ppm
0,today sorry day ever angry ever misbehaved hurt plz plz slap urself bcoz ur fault basically good
0,cheers card time year already
1,hot live fantasies call 08707509020 20p per min ntt ltd po box 1327 croydon cr9 5wb 0870 k
0,people see msgs think iam addicted msging wrong bcoz know iam addicted sweet friends bslvyl
0,ugh hopefully asus ppl dont randomly reformat
0,seen facebook huh lol
0,mah b pick tomorrow
0,still otside le u come 2morrow maga
0,u still plumbers tape wrench could borrow
1,dear voucher holder claim weeks offer pc please go http www e tlp co uk reward ts cs apply
0,vl bcum difficult
1,ur going 2 bahamas callfreefone 08081560665 speak live operator claim either bahamas cruise 2000 cash 18 opt txt x 07786200117
0,havent still waitin usual ü come back sch oredi
0,meeting da call
0,k k watch films
0,cinema plus drink appeal tomo fr thriller director like mac 8 30
0,size elephant tablets u shove um ur ass
0,many people seems special first sight remain special till last sight maintain till life ends take cr da
0,parents kidz friends n colleagues screaming surprise waiting sofa naked
0,dunno juz askin cos got card got 20 4 salon called hair sense tot da one ü cut ur hair
0,good morning pookie pie lol hope wake u
0,maybe woke fucking 3 problem
0,happy birthday dear lots love rakhesh nri
0,howz persons story
1,2nd time tried 2 contact u u 750 pound prize 2 claim easy call 08712101358 10p per min bt national rate
0,x2 lt gt going get
0,hi neva worry bout da truth coz truth lead 2 ur heart least unique person like u deserve sleep tight morning
1,ur awarded city break could win 200 summer shopping spree every wk txt store 88039 skilgme tscs087147403231winawk age16 1 50perwksub
0,ur paper today e morn aft
0,lick every drop ready use mouth well
0,expect whenever text hope goes well tomo
0,great p diddy neighbor comes toothpaste every morning
0,av new number wil u use one ta
0,poking man everyday teach canada abi saying hi
0,7 lor change 2 suntec wat time u coming
0,de seeing online shop asked
0,curious cuz asked
0,nice nice working
0,okay lor wah like def wont let us go haha say terms conditions
0,haha yup hopefully lose kg mon hip hop go orchard weigh
0,good r u working
0,oh yes little weather kind coccooning home
0,home also
0,phone weirdest auto correct
0,oops phone died even know yeah like better
0,havent mus ask u 1st wat meet 4 lunch den u n meet already lor u wan 2 go ask da ge 1st confirm w asap
0,said u mind go bedroom minute ok sed sexy mood came 5 minuts latr wid cake n wife
0,oh yeah hav great time newquay send postcard 1 look girls im gone u know 1im talkin bout xx
0,got divorce lol
0,ur pin
0,babe got enough money pick bread milk give back get home
0,want snow freezing windy
1,urgent trying contact u todays draw shows 2000 prize guaranteed call 09066358361 land line claim y87 valid 12hrs
0,come mahal bus stop lt decimal gt
0,know week going tirunelvai da
0,baby promise treat well bet take good care
0,like hotel dusk game think solve puzzles area thing
1,thanks ringtone order reference number x29 mobile charged 4 50 tone arrive please call customer services 09065989180
0,hi love goes day fuck morning woke dropped cell way stairs seems alright phews miss
0,well must pain catch
0,sorry da thangam mistake
0,need coz never go
0,rose red red blood blood heart heart u u send tis ur friends including u like u get back 1 u r poor relation 2 u need 1 support 3 u r frnd 2 many 4 some1 luvs u 5 some1 praying god marry u try
0,wife knew time murder exactly
1,six chances win cash 100 20 000 pounds txt csh11 send 87575 cost 150p day 6days 16 tsandcs apply reply hl 4 info
1,ur cash balance currently 500 pounds maximize ur cash send collect 83600 150p msg cc 08718720201 po box 114 14 tcr w1
0,feel like dick keep sleeping texts facebook messages sup town
0,plm come da way
0,guess wants alone time could show watch
